[
  {
    "pointId": "point-021",
    "booth": "A01",
    "label": "한국그린자원(주)",
    "markPosition": [30, -4.3, 13],
    "cameras": {
      "mobile": {
        "c": [801.5, 867.5, 1136.7],
        "t": [20.7, -4.3, 0.3],
        "z": 18.55
      }
    }
  },
  {
    "pointId": "point-022",
    "booth": "A02",
    "label": "(주)에스아이멤브레인",
    "markPosition": [30, -4.3, 8],
    "cameras": {
      "mobile": {
        "c": [678.5, 730.0, 952.7],
        "t": [22.4, -2.6, -2.2],
        "z": 18.55
      }
    }
  },
  {
    "pointId": "point-023",
    "booth": "A04",
    "label": "(주)더블유앤피코리아아",
    "markPosition": [30, -4.3, 3],
    "cameras": {
      "mobile": {
        "c": [680.1, 732.0, 950.0],
        "t": [24.0, -0.5, -4.9],
        "z": 18.55
      }
    }
  },
  {
    "pointId": "point-024",
    "booth": "A05",
    "label": "(주)현대밸브브",
    "markPosition": [30, -4.3, -2.5],
    "cameras": {
      "mobile": {
        "c": [681.9, 734.0, 947.2],
        "t": [25.8, 1.5, -7.6],
        "z": 18.55
      }
    }
  },
  {
    "pointId": "point-025",
    "booth": "A07",
    "label": "지에이치티코리아(주)",
    "markPosition": [30, -4.3, -8],
    "cameras": {
      "mobile": {
        "c": [683.7, 736.0, 944.4],
        "t": [27.6, 3.5, -10.5],
        "z": 18.55
      }
    }
  },
  {
    "pointId": "point-026",
    "booth": "A08",
    "label": "(주)스마트비젼",
    "markPosition": [30, -4.3, -12.5],
    "cameras": {
      "mobile": {
        "c": [685.4, 737.6, 942.1],
        "t": [29.3, 5.0, -12.8],
        "z": 18.55
      }
    }
  },
  {
    "pointId": "point-027",
    "booth": "A09",
    "label": "(주)에스테코(주)",
    "markPosition": [30, -4.3, -15],
    "cameras": {
      "mobile": {
        "c": [686.2, 738.7, 940.7],
        "t": [30.1, 6.2, -14.2],
        "z": 18.55
      }
    }
  },
  {
    "pointId": "point-028",
    "booth": "A10",
    "label": "(주)스타코인스트루먼트",
    "markPosition": [30, -4.3, -19],
    "cameras": {
      "mobile": {
        "c": [687.3, 740.1, 938.8],
        "t": [31.2, 7.6, -16.1],
        "z": 18.55
      }
    }
  },
  {
    "pointId": "point-029",
    "booth": "A11",
    "label": "(주)대한이엔씨(주)",
    "markPosition": [30, -4.3, -23.5],
    "cameras": {
      "mobile": {
        "c": [689.0, 741.7, 936.5],
        "t": [32.9, 9.1, -18.4],
        "z": 18.55
      }
    }
  },
  {
    "pointId": "point-038",
    "booth": "A11-1",
    "label": "(주)대한이엔씨(주)",
    "markPosition": [30, -4.3, -26.5],
    "cameras": {
      "mobile": {
        "c": [689.0, 741.7, 936.5],
        "t": [32.9, 9.1, -18.4],
        "z": 18.55
      }
    }
  },
  {
    "pointId": "point-030",
    "booth": "A12",
    "label": "(주)고려기술",
    "markPosition": [30, -4.3, -28.5],
    "cameras": {
      "mobile": {
        "c": [690.7, 743.3, 934.2],
        "t": [34.6, 10.6, -20.7],
        "z": 18.55
      }
    }
  },
  {
    "pointId": "point-031",
    "booth": "A13",
    "label": "한일네트워크엔지니어링",
    "markPosition": [30, -4.3, -31.5],
    "cameras": {
      "mobile": {
        "c": [692.4, 744.9, 931.9],
        "t": [36.3, 12.1, -23.0],
        "z": 18.55
      }
    }
  },
  {
    "pointId": "point-032",
    "booth": "A14",
    "label": "이플로우",
    "markPosition": [30, -4.3, -34.0],
    "cameras": {
      "mobile": {
        "c": [694.1, 746.5, 929.6],
        "t": [38.0, 13.6, -25.3],
        "z": 18.55
      }
    }
  },
  {
    "pointId": "point-033",
    "booth": "A14-1",
    "label": "리가오펌프",
    "markPosition": [30, -4.3, -36.5],
    "cameras": {
      "mobile": {
        "c": [695.8, 748.1, 927.3],
        "t": [39.7, 15.1, -27.6],
        "z": 18.55
      }
    }
  },
  {
    "pointId": "point-034",
    "booth": "A15",
    "label": "(주)쉘피아",
    "markPosition": [30, -4.3, -40.5],
    "cameras": {
      "mobile": {
        "c": [697.5, 749.7, 925.0],
        "t": [41.4, 16.6, -29.9],
        "z": 18.55
      }
    }
  },
  {
    "pointId": "point-035",
    "booth": "A16",
    "label": "(주)제이엠이엔비",
    "markPosition": [26, -4.3, -45],
    "cameras": {
      "mobile": {
        "c": [699.2, 751.3, 922.7],
        "t": [43.1, 18.1, -32.2],
        "z": 18.55
      }
    }
  },
  {
    "pointId": "point-036",
    "booth": "A17",
    "label": "한국핵융합에너지연구원",
    "markPosition": [22, -4.3, -45],
    "cameras": {
      "mobile": {
        "c": [700.9, 752.9, 920.4],
        "t": [44.8, 19.6, -34.5],
        "z": 18.55
      }
    }
  },
  {
    "pointId": "point-037",
    "booth": "A17-1",
    "label": "(주)엔케이 수중산업개발",
    "markPosition": [19.5, -4.3, -45],
    "cameras": {
      "mobile": {
        "c": [687.7, 752.6, 929.0],
        "t": [31.6, 20.0, -25.9],
        "z": 18.55
      }
    }
  },
  {
    "pointId": "point-038",
    "booth": "B01",
    "label": "B1 기업명",
    "markPosition": [12, -4.3, 8.5],
    "cameras": {
      "mobile": {
        "c": [690.0, 755.0, 925.0],
        "t": [35.0, 20.0, -20.0],
        "z": 18.55
      }
    }
  },
  {
    "pointId": "point-039",
    "booth": "B02",
    "label": "B2 기업명",
    "markPosition": [21.5, -4.3, 9.5],
    "cameras": {
      "mobile": {
        "c": [692.0, 756.0, 922.0],
        "t": [37.0, 21.0, -23.0],
        "z": 18.55
      }
    }
  },
  {
    "pointId": "point-040",
    "booth": "B03",
    "label": "B3 기업명",
    "markPosition": [18.5, -4.3, 5.5],
    "cameras": {
      "mobile": {
        "c": [694.0, 757.0, 919.0],
        "t": [39.0, 22.0, -26.0],
        "z": 18.55
      }
    }
  },
  {
    "pointId": "point-041",
    "booth": "B04",
    "label": "B4 기업명",
    "markPosition": [22.5, -4.3, 5.5],
    "cameras": {
      "mobile": {
        "c": [696.0, 758.0, 916.0],
        "t": [41.0, 23.0, -29.0],
        "z": 18.55
      }
    }
  },
  {
    "pointId": "point-042",
    "booth": "B05",
    "label": "B5 기업명",
    "markPosition":  [12, -4.3, 0],
    "cameras": {
      "mobile": {
        "c": [698.0, 759.0, 913.0],
        "t": [43.0, 24.0, -32.0],
        "z": 18.55
      }
    }
  },
  {
    "pointId": "point-043",
    "booth": "B06",
    "label": "B6 기업명",
    "markPosition":  [11.5, -4.3, -6],
    "cameras": {
      "mobile": {
        "c": [700.0, 760.0, 910.0],
        "t": [45.0, 25.0, -35.0],
        "z": 18.55
      }
    }
  },
  {
    "pointId": "point-044",
    "booth": "B07",
    "label": "B7 기업명",
    "markPosition":  [16, -4.3, -5],
    "cameras": {
      "mobile": {
        "c": [702.0, 761.0, 907.0],
        "t": [47.0, 26.0, -38.0],
        "z": 18.55
      }
    }
  },
  {
    "pointId": "point-045",
    "booth": "B08",
    "label": "B8 기업명",
    "markPosition": [22.5, -4.3, 12.5],
    "cameras": {
      "mobile": {
        "c": [704.0, 762.0, 904.0],
        "t": [49.0, 27.0, -41.0],
        "z": 18.55
      }
    }
  },
  {
    "pointId": "point-046",
    "booth": "B09",
    "label": "B9 기업명",
    "markPosition": [40.0, -4.3, -36.0],
    "cameras": {
      "mobile": {
        "c": [706.0, 763.0, 901.0],
        "t": [51.0, 28.0, -44.0],
        "z": 18.55
      }
    }
  },
  {
    "pointId": "point-047",
    "booth": "B10",
    "label": "B10 기업명",
    "markPosition": [40.0, -4.3, -40.5],
    "cameras": {
      "mobile": {
        "c": [708.0, 764.0, 898.0],
        "t": [53.0, 29.0, -47.0],
        "z": 18.55
      }
    }
  },
  {
    "pointId": "point-048",
    "booth": "B11",
    "label": "B11 기업명",
    "markPosition": [40.0, -4.3, -45.0],
    "cameras": {
      "mobile": {
        "c": [710.0, 765.0, 895.0],
        "t": [55.0, 30.0, -50.0],
        "z": 18.55
      }
    }
  },
  {
    "pointId": "point-049",
    "booth": "B12",
    "label": "B12 기업명",
    "markPosition": [40.0, -4.3, -49.5],
    "cameras": {
      "mobile": {
        "c": [712.0, 766.0, 892.0],
        "t": [57.0, 31.0, -53.0],
        "z": 18.55
      }
    }
  },
  {
    "pointId": "point-050",
    "booth": "B13",
    "label": "B13 기업명",
    "markPosition": [40.0, -4.3, -54.0],
    "cameras": {
      "mobile": {
        "c": [714.0, 767.0, 889.0],
        "t": [59.0, 32.0, -56.0],
        "z": 18.55
      }
    }
  },
  {
    "pointId": "point-051",
    "booth": "B14",
    "label": "B14 기업명",
    "markPosition": [12, -4.3, 8.5],
    "cameras": {
      "mobile": {
        "c": [716.0, 768.0, 886.0],
        "t": [61.0, 33.0, -59.0],
        "z": 18.55
      }
    }
  }
]
